<?xml version="1.0" encoding="UTF-8"?>
<!DOCTYPE beans PUBLIC "-//SPRING//DTD BEAN//EN" "http://www.springframework.org/dtd/spring-beans.dtd" >
<beans>
  <!-- most phone defaults properties is set in sipxconfig.properties.in -->
  <bean id="phoneDefaults" class="org.sipfoundry.sipxconfig.device.DeviceDefaults">
    <property name="dialPlanContext" ref="dialPlanContext" />
    <property name="domainManager" ref="domainManager" />
    <property name="sipxServer" ref="sipxServer" />
    <property name="serviceManager" ref="serviceManager" />
    <property name="logDirectory" value="${sysdir.log}"></property>
  </bean>


  <bean id="tftpProfileLocation" class="org.sipfoundry.sipxconfig.device.FileSystemProfileLocation">
    <property name="parentDir">
      <value>${sysdir.phone}/profile/tftproot</value>
    </property>
  </bean>

  <bean id="httpProfileLocation" class="org.sipfoundry.sipxconfig.device.FileSystemProfileLocation">
    <property name="parentDir">
      <!-- 
        - this is directory for a preferred place for serving 
        - phone configuration profiles for http access
        -    http://host:8090/phone/profile/docroot/, 
      -->
      <value>${sysdir.phone}/profile/docroot</value>
    </property>
  </bean>

  <bean id="velocityProfileGenerator" class="org.sipfoundry.sipxconfig.device.VelocityProfileGenerator">
    <property name="templateRoot" value="${sysdir.etc}" />
    <property name="velocityEngine" ref="velocityEngine" />
  </bean>
  
  <bean id="restartExecutorService" class="org.springframework.scheduling.concurrent.ScheduledExecutorFactoryBean">
  </bean>
</beans>
