<?xml version="1.0" encoding="UTF-8"?>
<!DOCTYPE beans PUBLIC "-//SPRING//DTD BEAN//EN"
  "http://www.springframework.org/dtd/spring-beans.dtd">
<beans>
  <!-- models -->
  <bean id="mitel5224" parent="abstractPhoneModel">
    <property name="label" value="Mitel 5224" />
    <property name="beanId" value="mitel" />
    <property name="maxLineCount" value="1" />
    <property name="profileTemplate" value="mitel/mn.txt.vm" />
	<property name="vendor" value="MITEL"/>
  </bean>
  <!-- implementation -->
  <bean id="mitel" class="org.sipfoundry.sipxconfig.phone.mitel.MitelPhone" singleton="false" parent="abstractPhone">
  </bean>
</beans>
