<?xml version="1.0" encoding="UTF-8"?>
<!DOCTYPE beans PUBLIC "-//SPRING//DTD BEAN//EN"
	"http://www.springframework.org/dtd/spring-beans.dtd">
<beans>
  <bean id="testPhoneModel" parent="abstractPhoneModel" class="org.sipfoundry.sipxconfig.phone.TestPhoneModel">
    <property name="label" value="Test Phone" />
  </bean>

  <bean id="testPhone" class="org.sipfoundry.sipxconfig.phone.TestPhone" singleton="false" parent="abstractPhone" />
  
  <bean id="testXmlRpcFunctions" class="org.sipfoundry.sipxconfig.xmlrpc.XmlRpcProxyFactoryBean">
    <property name="serviceUrl">
      <value>http://localhost:9997</value>
    </property>
    <property name="serviceInterface">
      <value>org.sipfoundry.sipxconfig.xmlrpc.TestFunctions</value>
    </property>
  </bean>

  <bean id="systemAuditManager" class="org.sipfoundry.sipxconfig.systemaudit.SystemAuditManagerMock"/>
  <bean id="systemAuditManagerImpl" class="org.sipfoundry.sipxconfig.systemaudit.SystemAuditManagerMock"/>

</beans>
